Event Category,Page Title,Total Events,Unique Events,Event Value,Avg. Value
Visit Source,Stewart Hills: Antarctica - Big Ten Academic Alliance Geoportal,1,1,0,0.00
Visit Source,"Stocked Trout Water Bodies (Points): Pennsylvania, 2019 - Big Ten Academic Alliance Geoportal",1,1,0,0.00
Visit Source,"Street Trees: Madison, Wisconsin - Big Ten Academic Alliance Geoportal",1,1,0,0.00
Visit Source,Thiel Mountains: Antarctica - Big Ten Academic Alliance Geoportal,1,1,0,0.00
Visit Source,"Topographic map of the Island of Kauai, Kauai County, Hawaii - Big Ten Academic Alliance Geoportal",1,1,0,0.00
Visit Source,"Traffic Analysis Zones By Population: Washington, D.C. - Big Ten Academic Alliance Geoportal",1,1,0,0.00
Visit Source,"Tree Farms: Oakland County, Michigan - Big Ten Academic Alliance Geoportal",1,1,0,0.00
Visit Source,Trout Natural Reproduction With Tributaries - Big Ten Academic Alliance Geoportal,1,1,0,0.00
Visit Source,"Urban Rural Demarcation Line: Baltimore County, Maryland - Big Ten Academic Alliance Geoportal",1,1,0,0.00
Visit Source,Vaccine Mapper: COVID-19 Vaccine Knowledge Base - Big Ten Academic Alliance Geoportal,1,1,0,0.00
Visit Source,Vegetation of Michigan circa 1800s: University of Michigan - Big Ten Academic Alliance Geoportal,1,1,0,0.00
Visit Source,Warrick and Spencer counties soil map test - Big Ten Academic Alliance Geoportal,1,1,0,0.00
Visit Source,Wastewater Treatment Plants [Iowa] - Big Ten Academic Alliance Geoportal,1,1,0,0.00
Visit Source,"Wetland - National Wetlands Inventory: Cuyahoga County, Ohio - Big Ten Academic Alliance Geoportal",1,1,0,0.00
Visit Source,Wetlands - Wetlands (National Wetlands Inventory): Maryland - Big Ten Academic Alliance Geoportal,1,1,0,0.00
Visit Source,Wetlands and Deepwater Habitats of the National Wetlands Inventory (NWI): Indiana - Big Ten Academic Alliance Geoportal,1,1,0,0.00
Visit Source,Wilhoite Nunataks: Antarctica - Big Ten Academic Alliance Geoportal,1,1,0,0.00
Visit Source,Wisconsin Range: Antarctica - Big Ten Academic Alliance Geoportal,1,1,0,0.00
Visit Source,Ymers Nunatakker: Greenland - Big Ten Academic Alliance Geoportal,1,1,0,0.00
Visit Source,Yule Bay: Antarctica - Big Ten Academic Alliance Geoportal,1,1,0,0.00
Visit Source,"Zoning Districts: Chicago, Illinois - Big Ten Academic Alliance Geoportal",1,1,0,0.00
Visit Source,"Zoning Districts: Stearns County, Minnesota, 2016 - Big Ten Academic Alliance Geoportal",1,1,0,0.00
Visit Source,"О-34-106-C Сабиле (Sabile, Latvia) - Big Ten Academic Alliance Geoportal",1,1,0,0.00
Visit Source,"О-34-126-D/127-C Бернати (Bernāti, Latvia) - Big Ten Academic Alliance Geoportal",1,1,0,0.00
